aid	deepl_title
130851	Doubts about estimated construction costs for Cologne cable car idea
130852	The Wipperfürth market place through the ages
130853	Man loses control of car and drives into the river Sülz
130854	Bergisch bicycle bus starts its third season
130856	RWE flexes its muscles vis-à-vis the government
130857	Life expectancy of poorer people still lower
130858	Gündogan leaves Manchester City future open for now
130859	"""Barack Obama is deeply relaxed"""
130860	Schalke 04 parts ways with coach Domenico Tedesco
130862	Owner charged with involuntary manslaughter
130863	Concern about Jan Hofer - Moderator reports via Twitter
130864	Body discovered near Meldorf
130865	The days of the bank branch are numbered
130866	"""Harry Potter"" star sits in wheelchair waiting for surgery"
130867	Frankfurt celebrates magical night at Inter Milan
130868	Feast for gardeners and gourmets
130869	A journey through the magical world
130870	Great feelings with the man at the piano
130871	All Bauhaus, or what?
130872	Thomas Kessler on his role as substitute keeper and the FC
130873	"""No one in the country should go to a mosque now""."
130874	What are the police allowed to do - and what are they not allowed to do?
130875	"""Get out of the woods!"""
130876	City wants to open Gladbach city permanently for cyclists
130877	Roads in Bad Münstereifel are being rehabilitated
130878	Only when it becomes cozy, stalls are to be set up
130879	Many fourth graders move away from Engelskirchen
130880	More and more tourists come but skilled personnel is missing
130881	Bielefeld main station to be closed: Longer travel times
130882	Digital school between aspiration and reality
130884	Worldwide climate rallies planned in over 1650 cities
130885	Erich-Kästner-Schule to use the property
130886	New farm store opened in Lohmar
130887	Artists doubt urgency of forced eviction
130888	Further struggle for City C in Leverkusen
130889	Telenotarzt system in operation for two years in the Euskirchen district
130890	1000 starters at Cologne running classic in the Forstbotanischer Garten
130891	SEK arrests five suspected rockers - one in Cologne
130893	Hundreds of thousands of young people demonstrate worldwide for the climate
130894	Solid start for Kaymer at Players Championship
130895	Schalke supervisory board chief regrets separation from Tedesco
130896	A4 towards Olpe closed due to truck fire: Duration still unclear
130897	Specialist forum of circus pedagogy takes place in Cologne
130898	"World protest day ""Fridays for Future"" with Rose Monday float"
130899	Man tries to break into woman's car
130900	Hamilton and Mercedes dominate Melbourne practice
130901	Apple rejects competition allegations from Spotify
130902	Frankfurt threatens fan exclusion in Europa League
130903	10,000 people demonstrate in Cologne for climate protection
130904	Kramp-Karrenbauer's popularity plummeted
130905	Bicycle bus now also runs from Gladbach
130906	Picture Book Museum Wissem celebrates return of Janosch collection
130907	CDU is in favor of establishing a nursing school in Euskirchen
130908	Conservationists in Erftstadt have a lot of work with toad migration
130909	The village community Berghausen has big plans
130910	Fake policemen and grandson trick scammers bag 14 million
130911	Coalition agrees roadmap for climate protection and mobility
130912	Anis Amri probably planned further attacks in Berlin
130913	China's People's Congress promises opening by law
130914	Did 23-year-old pay for smartphone with counterfeit money?
130915	From the screen to the stage
130916	Little polar bear lady may go outdoors for the first time in public
130917	Jussie Smollett Pleads Not Guilty
130919	31 prisoners died behind bars in NRW in 2018
130920	Woman seriously injured in accident in Elsdorf
130921	Police forbids man from Wachtberg to enter apartment
130922	9 questions that only professional tourists can answer
130925	German winemakers discover foreign countries as a lucrative sales market
130926	Zidane starts rebuilding the royals
130928	Police free two-year-old left alone from apartment
130929	Sammer criticizes Löw decision
130930	"""When D-day came, we had to function""."
130931	Construction of refugee accommodation on Sandstraße begins
130932	Wuppertal public prosecutor's office evacuated because of suspicious package
130934	Niederpleiser forest remains closed for the time being
130935	Brexit postponement short or long?
130936	New lights in Gladbach come later than planned
130937	Butterfly garden in Ahrhütte opens again for visitors
130938	Elsdorf spring market takes place again
130940	Anno-Gymnasium in Siegburg offers the language soon
130941	How competition between partners can damage the relationship
130943	Fire spreads to single-family house in Mechernich
130944	Compassion, solidarity and anger after attack on mosques
130945	Three rookies and clear words on the booting out
130948	Squad planning proves difficult
130949	Truck drives into end of traffic jam near Cologne-Dellbrück - five injured
130950	BUND offers walks through native nature
130951	Löw declares renunciation of FC captain Jonas Hector
130952	Draw: Liverpool expects Porto - Spurs against Man City
130953	30-year-old Senegalese injured by police shot during deportation
130954	City of Cologne to contract KVB for another 22.5 years
130955	Ex-museum director Okwui Enwezor died
130956	"Löw: No ""egg dance"" with Müller and Co. - Three newcomers"
130957	Tah on Bayer's goals for the season and the DFB squad
130959	Thousands of students demand radical change in climate policy
130960	Even more weapons found with suspected Reichsbürger
130961	Artists write open letter to Cologne's mayor Reker
130962	Now also with Löw: Hertha's Stark can also score goals
130963	Ford cuts 5000 jobs in Germany
130964	Ski racer Luitz has success before CAS: Victory back again
130965	What we know so far about the attack - and what not
130966	The dangerous game of the national coach Joachim Löw
130967	Lanxess with strong earnings but subdued outlook
130968	Police arrest two Bandidos in Cologne
130969	Lack of political support: Bieber leaves NRW Forum
130971	Motorcyclist fakes accident and tries to rape rescuer
130972	AfD politician courts female voters on Tinder
130973	Trio of robbers raids tailor shop in Cologne city center
130974	DIY stores fight for the dying do-it-yourselfer
130975	Central Council of Muslims warns of attack in Germany
130976	"Furious start of the ""Seven nights of tribute"" in Bielstein"
130977	200 refugees live in Engelskirchen
130978	After a year of losses: Ford cuts more than 5,000 jobs in Germany
130980	Greywacke from India has arrived - test in the laboratory
130981	NRW police switch to Ford S-Max - BMW too small
130982	City of Cologne to modernize more than 250 Cologne traffic lights
130983	"""Arrange in small packets""."
130984	"DFB coach Kramer on Youth League: ""Highly questionable""."
130985	Play with light and words
130986	Neighbors dialed 911 when Otto Piene was creating art
130987	Engelskirchen teachers travel with students to the climate demo
130988	Aldi ice cream may contain metal shavings
130989	Anfang hopes for return of his sick
130990	Cologne Higher Regional Court overturns acquittals for activists
130992	Cardinal Woelki and the official caravan
130993	Heidenheim puts damper on Union in promotion race
130994	Paris prosecutor's office to investigate Pope's ambassador
130995	Fortuna Cologne's rain battle ends 1:1 - Cone seriously injured
130997	Department store group now called Galeria Karstadt Kaufhof
130998	Gladbach only draw against Freiburg
130999	Cologne Sharks lose game two as well
131001	Time travel to the Middle Ages
131003	It's noisy in the car city of Leverkusen
131004	Almost no one wants the parking lot
131005	New attempt to reach agreement in steel wage negotiations
131006	Factions for moderate expansion of the comprehensive school
131008	"These speakers are taking part in the ""World Leadership Summit"" in Cologne"
131009	Cologne must not be Bochum
131010	Leverkusen presents new noise action plan
131011	Online platform could revive Zülpicher city center
131012	The trail in Rösrath is still not secured
131013	Why sleeping in sometimes makes us so tired
131014	Irish Spring Festival with atmosphere and Irish passion
131015	A Burscheider next to Otto Dix and Max Ernst
131016	Rita Hemmersbach from Erp takes in strays and found animals
131017	63-year-old pedestrian hit by truck and seriously injured
131018	Hamilton takes first pole of the season - big gap to Vettel
131019	Irmgardis-Gymnasium cooperates with Senior High School in Ghana
131020	Murder charges filed against shooter - children among the victims
131021	"Little prospect of success for model lawsuit on the ""revocation joker"
131022	"Habitat"" furnishing chain closes all stores in Germany"
131023	Application deadline for top posts ends on Sunday
131024	Health department warns parents and teachers about chickenpox
131025	Showcase on the 19th century in the city museum completely redesigned
131026	Königsforst forester Horst Winter dead at the age of 80
131027	Hedwig Radermacher one of the oldest people with Down syndrome
131028	Canteen at Pulheim high school dispenses with plastic dishes
131029	Kramp-Karrenbauer criticizes truancy over climate protest
131032	"""The students have already achieved a great deal"""
131033	Wolf Biermann wants to be buried in Berlin
131036	Cultural workers appeal to Henriette Reker
131038	Show on the destruction of cultural assets in the Near East
131039	Patient dies after fire in NRW hospital
131040	FC match against Duisburg cancelled - pitch unplayable
131041	Deutsche Bahn plans online applications
131042	Christiane Jäger elected new head of Cologne SPD
131043	Felix Neureuther ends his skiing career
131045	Leverkusen can make step towards Champions League
131046	Protective walls erected in Hennef - Mondorf ferry not running
131047	This is behind the weapons described
131048	Pension president calls for basic pension from tax revenues
131049	Comeback for Finnbogason at FC Augsburg
131050	Car thieves make loot in Cologne swimming pools
131051	1. FC Köln remains league leader despite match cancellation
131052	HSV loses in promotion race against Darmstadt 98
131053	Cologne remain top of table - Hamburg slip up
131054	Disappointment: German women's relay team fourth at biathlon world championships
131055	Rummenigge and Real no longer against Club World Cup
131056	American woman meets her lifesaver in Cologne
131057	"Fans will like ""Mirror, Mirror"" - others won't"
131058	Amy Adams lands as a producer at HBO
131059	AfD politicians with migration background found association
131060	The national team is not in the best hands
131061	US poet W.S. Merwin is dead
131062	Andrej Kramaric sets Hoffenheim's club record
131063	"Booing at ""Robbers"" performance at Schauspiel Cologne"
131064	"""Mass animal hell"": pig farmer sentenced for animal cruelty"
131065	Loan Zuber saves VfB a point against Hoffenheim
131066	Schalke 04 loses even with Stevens - Augsburg 96
131067	Augsburg turns game against Hannover - goal to stay in the class
131068	Thousands of neo-Nazis and hooligans expected in Chemnitz
131069	Cologne Sharks threatened with next playoff defeat
131070	"Funkel scolds and warns: ""Alarm bells must ring""."
131071	Erdogan to be guest of honor at Özil's wedding
131072	Dispute between referee Gräfe and 96 coach Doll
131073	At least nine seriously injured in bus accident in Mönchengladbach
131074	"Violence flares up again at ""yellow vests"" protests in Paris"
131075	After next defeat: Heldt supports coach Doll
131077	Holtmann Gallery in Cologne celebrates 40th birthday
131078	"This is what happens at the ""Tag der Begegnung"" anniversary in Cologne"
131079	Berlin polar bear baby delights zoo visitors
131080	Manchester City averts embarrassment in FA Cup
131081	Grindel: Löw should have given reasons earlier
131082	Last-minute win for BVB: Reus saves 3:2 in Berlin
131084	Jochen Ott leaves after 18 years as party leader
131086	Munich's Seidenberg suspended for next DEL playoff game
131087	Victory in Braunschweig: promoted Vechta continues to impress
131088	Cars collide near Much - two seriously injured
131089	Milad Adel Mohammadi processes his experiences on stage
131090	"""Could also drop an entire plant""."
131091	"Cologne politicians criticize ""noise car"" deployment teams"
131092	Mosque visitor probably prevented further attacks
131093	The party faces a difficult repositioning
131094	Exhibition commemorates Bauhaus student Martin Jahn
131095	"""Nutty"" Weghorst gets the ball as a reward"
131096	Bottas wins - Vettel perplexed: Why are we so slow?
131097	"Federal government wants to put ""identity fakers"" under pressure"
131098	Cologne musician Purple Schulz is back with new album
131099	"Historians call for ""House of City History"" in Cologne"
131100	Suddenly a teacher - What it feels like to make a career change at a school
131101	Warehouse fire in Hitdorf causes damage in the millions
131103	Fire in manufacturing hall in Jülich
131104	"""We didn't come in here to just get on with it""."
131105	Future committee decides on residential development areas in Kürten
131106	Eifel Rur water board releases water from dams
131108	Citizens discuss the design of the Rheindorfer Platz
131109	Police stop illegal race in downtown
131112	Annette Frier would allow children demo participation
131115	Felix Magath makes for a laugh with a quirky appearance
131116	"""In Cologne schools, ""You Jew"" is used as a swear word""."
131119	Solution for bicycle jungle at Cologne high schools in sight
131120	NRW forests still too dry despite rain
131121	Podolski celebrates first goal of the season - ex-FC colleague equalizes
131122	One in nine schools in NRW without a head teacher
131123	Hydrogen leaked at Praxiar
131124	"KVB stop ""Äußere Kanalstraße"" to be renamed"
131125	Children to help plan playground in Johannes-Giesberts Park
131126	Mobile home in Dieringhausen burns out completely
131127	76 ongoing EU proceedings against Germany
131128	Drunk passenger attacks train driver with fire extinguisher
131129	18-year-old walks on highway and injures police officers
131130	Thousands of students try out apprenticeships
131131	Youth celebrated after egg attack on right-wing senator
131132	Homeless activists reach agreement with city in Dellbrück
131134	Alexander Brändle on the location and prospects of the UAS
131135	Werder Bremen wins 3:1 in Leverkusen
131136	Arte documentary highlights threat of antibiotic-resistant germs
131137	Homage to Joseph Marx - world premiere at the Junges Theater
131138	Anfang tests against SC Paderborn
131139	Work for a whole week
131140	Cologne residents donate 55,900 euros for new pub project
131141	Here's how school administrators respond to absenteeism
131142	Uncertain future for former Cologne broadcasting center
131143	Exhibition in Cologne shows the history of the People's Court
131144	Weak performance by Brandt, Wendell unsafe
131145	Doctors threaten warning strikes at more than 500 clinics
131146	Unknown spray victims in Chorweiler irritant gas in the face
131148	Graffitied VfR bus goes to the Africa Foundation of Dr. Berndt Otte
131149	Cologne author Sandra Roth reads from her new book on Tuesday
131151	Flight recorder data from crashed Boeings similar
131152	Bad news after the mud fight
131154	"""Abbamania"" thrills around 4500 spectators in the Lanxess Arena"
131155	DRK district manager retires
131156	Leverkusen professionals demonstrate how Bosz's system can fail
131157	New playoff hope for the Cologne Sharks
131158	"""Kölsch is the language in which I feel at home""."
131159	Fire devastates attic
131160	Goalkeeper Ospina collapses unconscious with head injury
131161	Double-cross plot pulled out by the hair
131162	Armando brings owner million
131164	Senior citizens allowed to participate in Cologne school board
131165	"Sahra Wagenknecht felt ""more and more burnt out"
131167	NRW social courts get reinforcement due to wave of lawsuits
131169	Kerber loses Indian Wells final to Andreescu
131171	A tsunami in slow motion
131172	Perseverance rewarded with medals
131173	"Nuremberg's slogans of perseverance: ""Keep on stepping on the gas""."
131174	Christiane Jäger is the first woman to head the SPD in Cologne
131175	Budget Ruppichteroth has only 4000 euros for voluntary
131176	Mother celebrates her daughter with Down syndrome in unusual post
131177	High time to get back to normal manners
131178	Leverkusen lags far behind in terms of charging options
131179	Hundreds of helpers clean up the Hürth city area
131180	Gladbach environmental committee must make a decision
131181	Tommy Engel with stage fright in the City-Forum in Euskirchen
131182	Personal words for great commitment
131184	Without a group win, Germany 2020 faces a tough group at the European Championship
131185	Sahra Wagenknecht shows herself vulnerable
131186	49-year-old man dies in accident on A3 - full closure lifted
131187	Oberberg libraries show other sides
131188	Sahra Wagenknecht talks about her illness
131189	Investor Kühne only believes in third place for HSV
131190	At 300 km/h from Berlin to Cologne
131191	"Schuster on the climate: ""It's definitely getting tougher""."
131192	This is how Zollstock has developed over the last 111 years
131194	"Neureuther: ""Very happy that the pressure is just off""."
131195	Ryanair plane triggers air emergency
131196	"Cologne's literary scene is an ""important antipole to Berlin"""
131198	42 percent of Germans in favor of zero premiums
131199	This is how the EURO 2020 works: A twelve-host tournament
131200	Marketplace in Cologne-Dellbrück to be redesigned
131201	Shirt numbers assigned to Müller, Boateng and Hummels
131203	"Rally for ""Equal Pay Day"" in Berlin"
131204	Power in the morning with apple cinnamon millet and hazelnuts
131205	In Lindlar-Hommerich, the Rodewies brothers manufacture files
131206	More and more underground glass containers in Troisdorf
131209	Folding creatures with great effect in Wiesdorf
131210	Guitarist Dick Dale dead at 81
131211	Route could be in place by the end of 2019
131212	Boy distributes savings of parents
131213	Lady Gaga is proud of her hairstylist
131214	Star director Luc Besson turns 60
131215	"""Captain Marvel"" continues to top the U.S. box office charts"
131216	"""King of the Surf Guitar"" Dick Dale died"
131217	Three teenagers die in discotheque
131218	Diane Kruger is proud of her toned belly
131219	"Klopp: Beckenbauer praise is ""like a knighthood""."
131220	May to hold another vote on her Brexit deal
131221	"Klinsmann: Situation around national team is ""a powder keg"
131223	Serbia's national coach sees great future for Jovic
131224	"""Fear was our companion, our home a prison""."
131226	Sweet flavors for e-cigarettes seduce teenagers
131227	"Kind doesn't want another change of coach: ""Pull it off"""
131228	Sixt doubles profit
131229	Injured Ginczek: Team training planned until end of March
131230	Affected Cologne residents tell of their forced evictions
131231	Numbers reassigned - Tah gets the 5 from Hummels
131232	15-year-old Rebecca from Berlin missing exactly one month
131233	German referee cancels derby - police use tear gas
131234	Defense lawyer doubts independence of the court
131235	Champions League games on weekends in the future?
131236	Suspect is arrested - motive still unclear
131237	Dispute over hospital costs: health insurers complain of incorrect billing
131238	That's what's behind the flying car above the rooftops of Cologne
131239	Ten-year-old cyclist slightly injured
131240	Chemnitz trial: defense casts doubt on judge
131241	Shots fired in streetcar - several injured in Utrecht
131242	Hanover-Bielefeld line: ICE route planned for speed of 300 km/h
131243	Bundesbank: Benefits of Cash Ceilings Questionable
131245	Lena Meyer-Landrut in portrait format
131247	Teenagers attacked and stolen in Eschborn
131248	Politicians show disappointment with Mesut Özil
131249	Why social media fails to delete the brutal video
131250	Organ pipes stolen from church
131251	After bloody feuds: Bandidos in Hagen dissolve
131252	In four hours by train from Berlin to Cologne
131253	Almost seven percent of imported goods in EU are counterfeit
131254	Volunteers work up the archive documents in the Odenthal town hall
131255	VW takes a crack at e-car promotion
131256	Women earned 22 percent less than men in NRW in 2018
131257	A glimpse into the future of the Werkself?
131258	Hashing and stabbing on the way to municipal reform
131259	From 1 April is an end to binge drinking at Ballermann
131260	Woman loses backpack with 10,000 euros cash in S11
131261	Liberals see coal phase-out as opportunity for Rhine-Erft district
131263	Another world star performs at the Roncalliplatz
131264	Mondorf ferry runs again from Tuesday
131265	FC Schalke 04 sets records for sales and net profit
131266	RE 1 and RE 5 do not stop in Leverkusen Mitte
131267	Leroy Sané presents himself in fur look
131268	Investigations against police officers discontinued
131269	Sané comes in 25,000 euro outfit - Löw missing due to surgery
131270	Alleged Summerjam rapist sentenced in Cologne
131271	Leroy Sané joins the DFB team in a quirky noble outfit
131272	Fortuna Köln's Maik Kegel out for around eight months
131273	Bavarian farmer sows huge marriage proposal
131274	Showman charged with involuntary manslaughter
131275	Dead whale has 40 kilograms of plastic in its belly
131276	Man with sharp firearm and fake ID arrested
131277	Hiking on the south bank of the Dhünn dam
131278	Federal police officers more strongly armed after Utrecht shooting
131279	Quick DFB comeback of Jonas Hector is improbable
131280	Loose stones at Drachenfels: barriers at access road
131281	"The app ""Intimarzt"" detects venereal diseases - completely anonymously"
131282	Truck tears off KVB overhead line on Luxemburger Straße
131283	Cologne chaplains send fire letter to Woelki
131284	Things must continue to look up - Sharks owe it to the public
131285	"Italy puzzles over death of ""Bunga Bunga"" witness"
131286	Two children try to steal tow truck from parking garage
131287	NRW government does not have a single pure electric car
131288	Thieves steal engine from boat of yacht club
131289	Remains of the building are in serious danger of collapse
131290	"Putin visits Crimea on the fifth anniversary of ""unification"""
131292	Police searched for the suspected shooter in NRW
131293	Organizers campaign in Cologne for high turnout in European elections
131294	Eicherhof Castle is always worth a visit
131295	Huge applause at the musical for the church mice
131297	Again five fifth classes in Eckenhagen
131299	Motion to applaud submitted to the municipal council
131300	Preparations for fiber optic cable underway
131302	Up to 1000 deaths feared from cyclone in Mozambique
131304	Callum Hudson-Odoi as reserve ahead of England debut
131305	"""Pug affair"": expert approves seizure and sale"
131306	"Broadcast of ""Team Wallraff"" should be prevented"
131307	Brewers strike for more money: no supply problem
131308	Utrecht: Initially further controls by the federal police
131311	Polar bear's first bath in the crowd
131313	No evidence of safe with messages from dead father
131314	Bundesrat decides on rules for driving bans: Hamburg examines
131315	Holstein Kiel maintains fifth place - damper for Union
131316	Househusband earns ridicule for having his wife's back
131317	Luegde: District informs about care relationship
131318	Cologne fans on trial for rioting in Düsseldorf
131319	Foundation as a sign of hope
131320	Include many opinions
131321	Toad protection fences installed
131322	"""Even the telephone book can be poetry""."
131325	Nature conservation restricts plans of 1. FC Köln
131326	"""Maria Theresa"" travels through the floodplain forest on the Sieg River"
131327	Masses of water flood campsite in the Eifel region
131328	Café prohibits children - this is the reasoning of the owner
131329	No extradition - Turkish prime suspect free for the time being
131330	The lights go out again in Leverkusen
131331	How digitization should simplify the process of going to the authorities
131332	"Klinsmann ""close"" to Löw again"
131334	5G mobile radio auction starts
131335	Lake Genkel sloshes thanks - loud roar
131336	Fire department tests new extinguishing technology with success
131337	Experts appalled by excessive zinc values
131338	A look into the studios of creative people from Opladen
131339	Organ pipes stolen from the Catholic church
131340	Dirk Nowitzki overtakes the great Wilt Chamberlain
131342	Brühl's mayor Freytag praises the new program
131343	What we know - and what we don't
131344	Christopher von Deylen only needs two more suitcases
131345	Nowitzki moves up in perpetual points leaderboard
131346	Association gives away 100 fruit trees in Cologne-Ehrenfeld
131347	On the way to old glory
131348	Unknown steal money from church and kindergarten
131349	"""Ehrenfeld inquired"" with Jochen Ott"
131350	"""I will remain loyal to the club for the rest of my life""."
131351	Shell to build its own power plant in Cologne-Godorf
131352	The Takufeld becomes a popular building site
131353	"For alumni, the new name is no more than a ""consolation plaster"""
131354	Tips at the potter
131355	The future of learning
131356	Five Cologne residents on trial for rioting in Düsseldorf
131357	Extent of damage to Cologne Cathedral still unclear
131358	Antibiotics research does not keep pace with the development of germs
131359	What you need to know about the 5G mobile auction
131360	Jerry Lee Lewis is doing better after stroke
131361	Why Ford is in such a severe crisis
131362	Huge clouds of smoke over Houston
131363	18-year-old man hits pedestrian - victim seriously injured
131364	Cuts in refugee aid: Laschet criticizes Scholz
131365	Liverpool pro Shaqiri missing Swiss national team
