aid	deepl_title
129855	Verena Bentele on Saturday as a guest in Morsbach
129856	Greens demand compensation for Klause on site
129857	Coach Di Francesco leaves AS Rome
129858	Wolfgang Bosbach courted as Spinner successor
129859	Martin Kind, the wrecking ball of Hannover 96
129860	Premier League investigates allegations against Manchester City
129861	"Federal Court of Justice ends long legal dispute over ""Stoererhaftung"
129862	Two oil drums dumped at the edge of the forest at the Müllerhof
129863	Quarrel in Cologne city center: man injures adversary
129864	Fortuna Cologne with offensive problem against Lotte's bulwark
129865	Trapp saves Eintracht Frankfurt draw against Inter Milan
129867	Red and defeat in Rennes: Arsenal threatened with eighth-final exit
129868	"""Extremely frightening"": Martin shocked by Causa Erfurt"
129869	Huge cargo plane expected at Cologne/Bonn Airport
129870	Fellaini resigns from Belgium national team
129871	Eintracht coach Hütter apologizes for freak-out
129872	"Hoeneß: ""I still have to think about the answer""."
129873	Former US President Barack Obama comes to Cologne
129874	DFB official: Everyone closes the lid on quotas
129875	Ralph Liebig wants to become mayor
129876	"How Spinner lost his power - what Veh saw as a ""breach of trust"
129877	Paul Manafort sentenced to nearly four years in prison
129878	Applicants for office management were able to access records
129879	Owner separates from Huma management
129880	Weight loss expert Bas Kast gives three tips that really slim down
129881	PBU met with members of the Bundestag
129882	Protest is of no use - Schleidener must pay
129883	Kuddelmuddel invites you to play again
129884	Eighth grade at high school receives 30 tablets for 20,000 euros
129885	Author Stephan Grünewald fires up round with many mnemonics
129887	Forest protection laboratory comes to alarming conclusions
129888	Police launch second search operation on Friday
129889	23-year-old injured in spectacular accident in Cologne-Holweide
129890	Frank Goosen in search of the soul of the Ruhr region
129891	Qualification alone is not enough - a law is needed
129892	City archive in Troisdorf digitizes registry office books
129893	Hiking bus is known even at Vesuvius
129894	Many Moses clients cannot escape their hardship
129895	City of Wesseling wants to close gaps in the network
129896	IHK and City of Cologne fight for less plastic waste
129897	Balkan Express to roll again
129898	Women's Day: majority of Germans in favor of public holiday
129899	Berg advertising block in Berlin
129900	Sidewalks in Cologne-Mülheim suffer from trucks
129901	Truck driver forgets raised loading platform and demolishes bridge
129902	NRW schools to educate about Turkish influence
129903	Finnish government resigns five weeks before election
129904	"Complaints about sidewalk - ""Visually it's a disgrace""."
129905	Power outage in Venezuela leaves hundreds of thousands in the dark
129906	Three women from Oberberg on their way to the top
129907	Bergisch Gladbach would not be a city of culture without Maria Zanders
129909	Attempted contract killing with gunshots in the open street?
129910	"""Simpsons"" creators want Michael Jackson episode banned"
129911	FDP and UWV demand change of the basic decision
129912	Barbie celebrates her 60th birthday
129913	Building application submitted for former Hit store in Bergheim
129914	Forger uses date on driver's license which does not exist
129915	A life as a professional revolutionary
129916	Zülpich honors blond cult object with a special exhibition
129917	Police pulls motorist with almost five per mille out of traffic
129918	Petry as a musical star
129920	These are the 6 most common misconceptions about divorce
129921	VfL Gummersbach parts ways with coach Bahtijarevic - successor is confirmed
129922	Refurbishment at lofty heights - for 1.5 million euros
129923	Bus bomber of Lübeck must go to psychiatric clinic
129924	"Office for the Protection of the Constitution accepts Cologne ruling on ""AfD test case"
129925	Opposing insurance company must question the driver of the accident
129927	Women earn significantly less
129928	Birgit Ludwig-Weber brings order to the community archive
129929	Serious accusations against animal rights activists from WWF
129930	Samuel L. Jackson keeps his fingers crossed for Jürgen Klopp
129931	Bolsonaro posts obscene video
129932	Mechanical engineering loses momentum
129933	Judge makes serious accusations in glyphosate trial
129934	18-year-old threatens and robs boy
129935	Police arrest travelers at Cologne Central Station
129936	New cookbook with 140 Jewish recipes from 22 countries
129937	Sleeping woman thrown out of motorhome roof hatch onto A3 motorway
129938	Fine imposed on carnivalists in Wülfrath
129939	400 finds on Nazi crimes unearthed
129941	An impulse is to go out from Cologne into the world
129943	Information on the tasks and powers of the dike association
129944	Children in Refrath have to play behind bars
129945	Europol seizes illegal drugs
129946	74-year-old man knocked down by bicycle and robbed
129947	Wanted man surrenders to police in Austria
129948	Event day in Nettersheim to cult series from the 60s
129951	Lots of retail and 70 apartments for the old premium location
129952	Extra point for fastest race lap to come
129953	Vogelsanger want to save their Büdchen
129954	These are Germany's 10 most beautiful beaches
129955	Fuel thief had neither registration for car nor driver's license
129956	TK-Max opens another store in Cologne
129957	Brawl at youth soccer match in NRW - goalkeeper seriously injured
129958	Kiosk at Vogelsang market is saved
129959	New accommodation for refugees opens in Porz-Urbach
129960	Laschet promotes the 2032 Olympics in NRW at the IOC in Lausanne
129961	Thieves x-ray luggage at Cologne Airport - arrests made
129962	Fire alarm in Euskirchen animal feed factory
129963	Giant freighter Antonov 124 landed in Cologne
129964	Man overlooks minibus near Wißkirchen - children in the car
129965	"""Good can grow out of evil""."
129966	Mare Jenny goes for a walk alone and becomes a star
129967	The warning against excessive expectations
129968	80-year-old woman hit, taken to doctor and fled
129969	A life for the violins - and a saxophone
129970	Back to the future of carnival
129971	More than 1000 participants paraded through Sieglar
129972	Sindorf children in the best of moods at Zoch
129973	Chestnut, maple, and birch trees must give way
129974	A little chess in the duel with Hanover
129975	Why it's good to put your car keys in the microwave in the evening
129976	Vox shows Jens Büchner on his deathbed - Is that impious?
129978	Naked mothers demonstrate in front of Cologne Cathedral - action with fake blood
129979	"""Pay me what you owe me and I'll get out of your hair""."
129980	"""My father has a tremendous influence on me""."
129981	What Martina Siems-Dahle's new novel is about
129982	Professional testers to check punctuality
129983	Rummenigge would like to tie Schweinsteiger to FC Bayern
129984	Georg Kruse presents his first novel
129985	FC Rhenania - a team full of sixes, sevens and eights
129986	Helping children of addicted parents better
129987	Responses to Overtourism in the USA
129988	Spinner counters Ritterbach statements
129989	Olympic champion Stjernen surprisingly ends his career
129990	Police officer in Lippe sentenced for child pornography
129991	An Iraqi woman talks about the luck of finding her own apartment
129992	Municipality and Roads NRW justified interventions in the Dhünnaue floodplain
129993	Legendary club in the Belgian Quarter is back again
129994	Halal is not organic - What a grotesque verdict!
129995	That's how much a selfie and dinner with Obama cost
129997	Defendant moaned into women's phone
129998	Trump wears out sixth communications director
129999	"What the Lego world ""Bricklive"" has to offer"
130000	"Volksbank Köln Bonn plans to ""convert"" 14 branches"
130001	Tickling the last out of an overloaded system
130002	Motorcyclist crashed near Götzenkirchen
130003	Fire in Wesseling threatened café and apartment building
130004	Julie Andrews receives honorary lion in Venice
130005	Lawyer wants to sue federal states and district in Lügde case
130006	Union Berlin wins duel with Ingolstadt & ex-coach Keller
130007	Heidenheim loses connection to promotion places
130008	Heidenheim loses connection - Union wins against ex-coach
130009	Actor Jan-Michael Vincent is dead
130010	Hundreds of students take part in computer science competition
130011	Woman overlooks parked car on the roadside
130012	Repair work on the railroad museum is completed
130013	Runners-up Eisbären Berlin also in DEL quarter-finals
130014	National players sue U.S. Soccer Federation
130015	S04 ever deeper in the crisis - Tedesco must fear for job
130016	Union informs police about tweet against Ingolstadt pro
130017	Kramp-Karrenbauer declares carnival debate over
130018	"""Airwolf"" actor Jan-Michael Vincent dead"
130021	Music, against forgetting
130022	Picturesque flowers in the city hall
130023	13-year-old from Oberberg is a successful YouTuber
130024	Rail delays increase in the Rhein-Sieg district
130025	Holzkontor Rhein-Berg has started its work
130027	Roofer from Bergheim had to overcome some resistance
130028	Karl Lauterbach announces improvements in Kall
130029	Police in Istanbul use tear gas against large demonstration
130030	Man trailer tips over onto car - driver dies
130031	"Goat ""Lincoln"" is now mayor of US city"
130032	Gabriel believes in premature end of Merkel era
130034	Tendon injury: Draxler misses international opener
130035	Baby of IS supporter dies in refugee camp
130036	How to tell if your pet is too fat
130037	New head for CDU Marienheide elected unanimously
130038	One-man bunker in Burscheid gets a monument plaque
130039	Hennef should become more attractive for cyclists
130040	Altenberg kitchen yard is extensively rebuilt
130042	Sötenicher campaign for preservation of mill
130043	Citizens' initiative considers planned supermarket oversized
130044	Satellite images show possible missile construction in North Korea
130045	Drunk man hits opponent with vacuum cleaner
130047	Young Waldbröler compete for the German Founder's Prize
130048	How Laschet and Mronz want to convince the IOC of the NRW Olympic project
130049	FC dominates the game - Terodde raises by head
130050	Double names are rather rare in NRW
130051	Thermomix 6 - Expensive premium mixer or kitchen miracle?
130052	New sponsor for Wipperfürth Don Bosco daycare center and OGS sought
130053	The big ranking of supermarket chains in Cologne
130054	Strike duo can shine almost undisturbed against Bielefeld
130055	This is the musical of Wolfgang Petry in the Cologne Musical Dome
130058	After Kreissparkasse, now Volksbank is also hit
130059	Olympus collage at Wesseling school is finished after several years
130060	Self-discovery video well received by schoolgirls
130062	Fortuna Köln celebrates dramatic 2:1 in Lotte
130064	Lewandowski top foreign Bundesliga scorer
130066	Injured Caligiuri missing Schalke four to six weeks
130067	Residents in Cologne-Meschenich stunned
130068	Leyhe crash overshadows team jumping: DSV in fifth place
130069	Senior wants to defrost refrigerator with candle - and triggers fire
130070	1. FC Köln defends its lead in the league with confidence
130071	More right-wing extremist soldiers unmasked in Bundeswehr than previously known
130072	FC Bayern overtakes Borussia Dortmund
130074	Leichlingen branch on Brückenstrasse to close on March 22
130075	Bayern take league lead - BVB beats VfB late
130076	RB Leipzig also fails against Augsburg's bulwark
130077	"Gabriel calls EU the ""last vegetarian of world politics"""
130078	Kantersieg provides an important insight into the team
130080	Gummersbach parts ways with coach Bahtijarevic
130081	19-year-old collides with tree in Wipperfürth
130082	Why the pinball machine has disappeared from many Cologne pubs
130083	Police break up hooligan brawl in Cologne-Dellbrück
130084	AKK presents own reform proposals for the EU
130085	"Wagenknecht relinquishes leadership of the ""Aufstehen"" movement"
130086	Mönchengladbach ends crisis: 1:0 at Mainz 05
130087	Gladbach back on course for the Champions League
130088	Plane crash takes the lives of twelve people
130089	Bayer 04 must start at desolate Hannover an
130090	Roncalliplatz - Cologne's living room is in semi-darkness
130091	Kramp-Karrenbauer counters Macron with her own reform proposals
130092	Schweinsteiger still waiting for first win with Chicago
130094	Tree falls on apartment building in Bonn
130095	Rummenigge wants to bring Schweinsteiger back
130096	Scene of the crime: Forever and you
130097	France dares to go it alone
130098	North Korea elects new parliament
130099	Unbeatable: Bob pilot Friedrich achieves the double hat trick
130100	Kindergarten children in Linde make nesting boxes for native birds
130101	Hecking confirms: I can imagine being national coach
130103	15 dialysis patients apparently died
130104	Neighborhood bus to get new route and cheaper fare
130105	Summer holiday care in Euskirchen becomes more expensive
130106	RWE must clean up toxic waste dump in Manheim forest
130107	Asylum seekers hope for protection status through self-incrimination
130108	Around 30 injured in passenger plane due to turbulence
130109	Father wants Daniel Küblböck declared dead
130110	R. Kelly back on the loose after three days
130111	Podolski wins 3:1 away with Kobe
130112	Soccer fan gets under train in Cologne-Dünnwald
130113	Exceptional case with great closeness
130114	Jennifer Lopez and A-Rod got engaged
130115	Construction industry calls for VAT reduction for social housing
130116	Hospital informs 78-year-old of impending death via video link
130118	At least 15 dead in attack on strip club in Mexico
130119	Two cars collide in Spich
130120	The city at the tourism fair - Cologne is food
130121	Five Germans die in plane crash in Ethiopia
130122	Schleiden's alderman elected for another eight years
130123	New development area in Hürth soon to be completed - 20 million invested
130124	"Access to Rösrath school center via ""An der Foche"" blocked"
130125	What the restaurant guides say about restaurants in the Rhein-Sieg district
130126	Initiative criticizes planned route of bicycle expressway
130127	Driver and passenger want to change places - collision with police
130128	Sylvie Meis met her new boyfriend on the film set
130129	Dog missing on snow tour turned up after three weeks
130130	Man riots in discotheque - several patrol cars on duty
130131	Four-year-old sets off Sunday morning for kindergarten
130132	Firefighters save four thirsty baby squirrels from certain death
130133	Outrage over new punctuality measurement at Deutsche Bahn
130134	Organic store warns customers about cheat pack on own shelf
130136	Freiburg with stand-up morale without danger of relegation
130137	City marketing fears image damage for the whole of Cologne
130138	The old megaphone gives way to social housing
130139	Radiology gets more space
130141	Maas criticizes Venezuela after expulsion of ambassador
130142	Good end of a utopia
130143	Second division match between Fürth and Dresden canceled
130146	Bus exploded in the city center of Stockholm
130147	Resident in Holzem notices smoke - seven people rescued
130148	FDP and state representatives criticize planned postage increase
130150	Body of girl washed up on island of Lesbos
130151	Kirchentag criticizes lack of education
130152	Man assaulted at Heumarkt bus stop and threatened with knife
130153	"""Alice in Wonderland"" comes to the stage as a rock musical"
130154	Storm in NRW: Weather service issues second-highest warning level
130155	Jean Pütz: QR code with video left on gravestone
130157	Jean Pütz wants to leave QR code with video on gravestone
130158	Talk with Rangnick after Sabitzer's criticism
130159	Federal Foreign Office tightens travel advice for Turkey
130160	Sylvie Meis and her new love
130162	Turbulent evening for Serhou Guirassy
130163	Deutsche Bahn suspends long-distance services in NRW
130164	Hoeneß takes Löw to task after Liverpool
130165	Boy locks out father at high altitude - spectacular rescue
130166	Nippes secondary school to move to Kunibertsviertel in 2020
130167	Mourning for right-wing hooligan?
130169	Report: Deutsche Bahn to introduce new punctuality calculation
130170	"""I had to take Stefan Raab to the car after the shows""."
130172	Sandhausen second to last after win at Magdeburg
130173	Four stoppages of play: HSV celebrates landslide win at Pauli
130174	Liverpool stays close to Man City - 4:2 win against Burnley
130175	Deutsche Bahn suspends long-distance services in NRW due to storm damage
130176	Roofing felt buries car in Cologne - cemeteries closed
130177	SPD honors Ulla Osberghaus as Wipperfürth's Woman of the Year
130178	Horizont youth center launches new project in Lindlar
130179	The three-way battle in the 1. FC Köln attack
130180	Danger for man and toad
130181	Advertising for the Rhine-Sieg district should inspire
130182	Kreissparkasse Köln closes eight branches in Rhein-Berg
130183	Fire department Rhein-Sieg in continuous operation - many fallen trees
130185	A new man for the Presidium
130186	Snow prevents safe goal against Bayer 04
130187	Fire department extinguishes fire in country hotel
130188	Red Salzburg sets record: 39 league home games undefeated
130189	Despite catch-up: Bitter 96 defeat in driving snow
130190	Hradecky saved from slush, Volland flourishes
130191	"""Forever and You"" is more drama than murder hunt"
130193	Fallen trees, covered roofs and power outages
130194	Nippes gets 23 new charging stations for e-cars
130195	Severe storm causes a lot of damage in the region
130198	Father allegedly killed his infants
130200	After the exit from the Champions League: Real Madrid wins at Valladolid
130201	Health insurance funds achieve surplus of two billion
130202	Invest money without investing in weapons and oil
130203	Trump to stop naming civilian drone victims
130204	Track cycling world champion Catlin dies at age 23
130205	Future of the House of Art
130206	Celebrities sewing box
130207	Green jewel in the middle of the city
130208	29 British must apply
130209	Two runs had to be cancelled
130210	Liberation from the aprons
130211	Parents want a more child-friendly city
130212	"Herrmann after world championship title: ""Making life difficult for others""."
130213	Team of the hour: Fortuna no longer even fears Jovic
130215	Tenth anniversary: Winnenden commemorates the victims of the rampage
130216	In the Rhine-Erft district the spring messengers are very early
130217	Already 1000 signatures collected for Aggerfreibad
130218	First learning night in public library becomes a success
130219	Spring feelings among autumn apples
130220	Nativity scene in Hellenthal parish home intact
130221	Defendant surprisingly gets off
130222	More brain infections from tick bites
130223	Airbus launches air cab model project in Ingolstadt
130224	Who should pay when the road is broken?
130225	Lufthansa seeks new takeover targets
130226	Maas promotes extension of Afghanistan mission
130227	Companies courted the youth
130228	What will be important this week in Cologne
130229	How to save electricity and money in the home
130230	After the storm: First trains in NRW are rolling again
130231	After crash in Ethiopia: Take-off bans for Boeing 737-8 Max
130232	Kelly Catlin dead at 23
130233	Verfassungsschutz: Right-wing martial artists rehearse street fight
130234	Parking garage next to Cinenova in Cologne-Ehrenfeld reduces costs
130235	Union's Ruhnert on political office: Knowing where you come from
130236	Dardai on Stark: Brings everything for national player
130237	Bobic criticizes soccer education in Germany
130238	Self-made fantasy worlds in the Tri-Café
130239	End of March last meeting in the Siegburg District House
130240	"""Taking it one step at a time"""
130241	Because 60 is the new 50 or even 40
130242	Artist Uwe Appold presented his work in the parish church St. Margareta
130243	"Beatrix von Storch considers Emmanuel Macron a ""loser"""
130245	German industrial production lower
130246	Tom Gerhardt marries his life partner
130247	FDP leader Lindner puts students down and earns shitstorm
130249	U-turn at Tesla: More stores stay, prices rise
130251	Gladbach administration could not refuse rental
130253	Heimatabend Oberwiehl celebrates togetherness
130254	This tactical trick of FC coach Anfang showed effect
130255	High-profile guests invited to event
130256	116 year old Japanese woman now oldest person in the world
130257	Tree threatens to fall on gas tank in Cologne-Fühlingen
130258	Andreas Bausch awarded the Rhenish Art Prize
130259	"""Beverly Hills, 90210"" actor Jed Allan dead"
130260	George Foreman mourns the death of daughter Freeda
130262	No referee in video cellar at Real game
130264	Under the garbage were 35 square meters of laminate flooring
130265	Regulation for one-way street made clearer
130266	Empty video referee room in Valladolid causes mystery
130267	Rail boss Lutz: Long-distance trains 80 percent on time in February
130268	Cologne cable car to be running again by Easter at the latest
130269	Japanese still struggling with consequences of tsunami disaster
130270	"""There are one to two students with dyscalculia per class""."
130272	Rail traffic on the S6 around Leverkusen still disrupted
130273	Cologne politicians want extra lighting for sidewalks
130274	District government reprimands Reker - city contradicts
130275	Fire department in continuous operation - follow-up operations during the night
130276	Uth and Harit again not in Schalke squad
130277	Case remains mysterious - pressure on police grows
130278	"Police officer beats up defenseless ""yellow vests"" activist"
130279	Snack bar employee saves life of regular customer
130280	Women sexually harassed on train between Cologne and Stolberg
130281	Correctly regulate storm damage
130282	Cologne police comb eleven bars in Nippes and Chorweiler
130283	The background to Infantino's pumped-up Club World Cup
130285	Does Volland shoot himself into Löw's field of vision?
130286	"""Eberhard"" causes damage to the cathedral"
130287	Tui considers grounding its Boeing 737 Max 8 aircraft
130288	3000 people without electricity, heating and light
130289	Giant cargo plane returns around 2:30 p.m.
130290	Germany puts little money into continuing education
130291	Dealer tries to swallow drugs
130292	Haie coach Lacroix on the playoffs and bloody Youtube videos
130293	"Snowfall and many operations due to storm ""Eberhard"
130294	Lewandowski missing from Bayern training ahead of Liverpool game
130295	Man arrested with 300 grams of cocaine in his underpants
130296	Two brothers beat local resident in Wesseling
130297	Cologne: Spinner called on vice presidents to make redundancies
130298	How iPhone users share their wifi - without revealing the password
130299	"""Eberhard"" knocks down hundreds of trees"
130300	Al Bano blacklisted in Ukraine
130301	Overather pop singer Peter Orloff celebrates in Lohmar
130302	Tree crashes into sofa - Mülheimer lives because he wanted to smoke
130303	Sahra Wagenknecht is no longer a candidate for the chairmanship of the parliamentary group
130304	Tree falls on car and seriously injures driver
130305	Zidane becomes coach at Real Madrid again
130306	Storm causes standstill on highway and railroad tracks
130307	The best photo spots in front of German landmarks
130308	Driver in Hennef leaves burning car just in time
130309	Pediatricians and adolescents call for mandatory vaccination against measles
130310	Wuppertal Regional Court convicts man of 20 counts of attempted murder
130311	Steffi Graf laments physical consequences of her career
130312	Gündogan surprised by Löw decision against Bayern trio
130313	Vote in the big Cologne health checkup
130314	Cologne agency informs about vacancies
130316	Wagenknecht does not run for chair of the Left Party parliamentary group
130317	Müller-Römer to be elected Spinner successor this evening
130318	Burglars in the Raiffeisen market at the Leichlingen train station
130319	"Big secret about filming for ""Babylon Berlin"
130320	Children killed with cuts: Father under suspicion
130321	Pastor collapses and dies after farewell sermon
130322	How wife Claudia cost Stefan Effenberg his Schalke job
130323	Secretary of State: Brexit vote will take place as planned
130324	Man comes to police station with pipe bomb
130325	More than one in five pairs of shoes is bought online
130326	"""We got through the worst of it""."
130327	Leverkusen schoolgirl with exceptional commitment
130328	Power failure in Kürten paralyzes Radio Berg
130329	Energy labels for lamps and refrigerators become clearer
130330	Still a lot of work in Oberberg - Do not enter forests
130331	Entire EU airspace closed for Boeing 737 Max 8
130332	Participants from all over Germany attracted to Gummersbach
130334	Three men sentenced for aggravated gang theft in Cologne
130335	HSV against Darmstadt 98 without captain Hunt
130336	Police station in Wipperfürth with new management
130337	"""State forces people to jump off the bridge""."
130338	Waldbröler fire brigades can accommodate more young people in the future
130339	Passengers have to wait hours for their suitcases
130340	Roof of a sports hall in Poll collapses
130341	Menzel sketch back in the Museum of Prints and Drawings
130342	Trouble over new Thermomix - threats of legal action against Vorwerk
130343	Scholz: Deutsche Bank and Commerzbank sounding out the situation
130344	"Will the ""Rheinpendel"" solve Cologne's traffic problem?"
130345	Investigations are completed - sobering results
130346	Cohen suspended for one game after red in Berlin
130347	LEG to build 500 new apartments in Cologne
130348	Real brings back Zidane in the crisis - Solari dismissed
130349	"Tedesco on the game at Manchester Ciy: ""Seize the opportunity""."
